<?xml version="1.0" encoding="utf-8"?>
<!DOCTYPE anime_catalog SYSTEM "anime_catalog.dtd">

<anime_catalog>
    <anime anime_id="2">
        <main_info>
            <title>Naruto Shippuden</title>
            <author nationality="Japanese">Masashi Kishimoto</author>
            <genre>Action, Adventure, Comedy</genre>
            <type>Shounen</type>
            <source>Manga</source>
        </main_info>
        <show_info>
            <seasons>
                <season episodes="32">1</season>
                <season episodes="21">2</season>
                <season episodes="18">3</season>
                <season episodes="17">4</season>
                <season episodes="24">5</season>
                <season episodes="31">6</season>
                <season episodes="8">7</season>
                <season episodes="24">8</season>
                <season episodes="21">9</season>
                <season episodes="25">10</season>
                <season episodes="21">11</season>
                <season episodes="33">12</season>
                <season episodes="20">13</season>
                <season episodes="25">14</season>
                <season episodes="28">15</season>
                <season episodes="13">16</season>
                <season episodes="11">17</season>
                <season episodes="21">18</season>
                <season episodes="20">19</season>
                <season episodes="66">20</season>
                <season episodes="21">21</season>
            </seasons>
            <all_episodes>500</all_episodes>
            <duration unit="minutes">23</duration>
        </show_info>
        <publish_info>
            <aired>
                <begin>15 Feb 2007</begin>
                <end>23 Mar 2017</end>
            </aired>
            <premiered season="Winter">2007</premiered>
            <studio>Studio Pierrot</studio>
            <producers>TV Tokyo, Aniplex, KSS, Rakuonsha, TV Tokyo Music, Shueisha</producers>
            <licensors>VIZ Media</licensors>
        </publish_info>
        <statistics_info>
            <score>8.23</score>
            <rank>288</rank>
            <popularity>16</popularity>
        </statistics_info>
    </anime>
</anime_catalog>