<?xml version="1.0" encoding="utf-8"?>
<!DOCTYPE anime_catalog SYSTEM "anime_catalog.dtd">

<anime_catalog>
    <anime anime_id="4" is_going="ะะต">
        <main_info>
            <title>Tokyo Revengers</title>
            <author>Ken Wakui</author>
            <genre>Action, Drama, Supernatural</genre>
            <type>Shounen</type>
            <source>Manga</source>
        </main_info>
        <show_info>
            <seasons>
                <season episodes="13" period="2021">1</season>
            </seasons>
            <all_episodes>13</all_episodes>
            <duration unit="minutes">23</duration>
        </show_info>
        <publish_info>
            <aired>
                <begin>11 Apr 2021</begin>
                <end>19 Sep 2021</end>
            </aired>
            <premiered unit="year" season="Spring">2021</premiered>
            <studio>LIDENFILMS</studio>
            <producers>Pony Canyon</producers>
            <licensors>Unknown</licensors>
        </publish_info>
        <statistics_info>
            <score>8.24</score>
            <rank>285</rank>
            <popularity>161</popularity>
        </statistics_info>
    </anime>
</anime_catalog>